"No.","Time","Source","Destination","Protocol","Length","Info"
"1","0.000000","192.168.2.10","239.255.255.250","IPv4","1506","Fragmented IP protocol (proto=UDP 17, off=0, ID=59e1) [Reassembled in #2]"
"2","0.000079","192.168.2.10","239.255.255.250","UDP","639","1071  >  8082 Len=2069"
"3","0.292558","Sagemcom_f8:80:f0","Spanning-tree-(for-bridges)_00","STP","56","Conf. Root = 32768/0/84:a0:6e:f8:80:f1  Cost = 0  Port = 0x8003"
"4","0.585414","192.168.2.13","239.255.255.250","UDP","506","1082  >  8082 Len=464"
"5","0.792918","Sagemcom_f8:80:f0","Spanning-tree-(for-bridges)_00","STP","60","Conf. Root = 0/1/00:26:86:00:00:00  Cost = 90  Port = 0x8006"
"6","1.292399","Sagemcom_f8:80:f0","Spanning-tree-(for-bridges)_00","STP","56","Conf. Root = 32768/0/84:a0:6e:f8:80:f1  Cost = 0  Port = 0x8003"
"7","2.292738","Sagemcom_f8:80:f0","Spanning-tree-(for-bridges)_00","STP","56","Conf. Root = 32768/0/84:a0:6e:f8:80:f1  Cost = 0  Port = 0x8003"
"8","2.793215","Sagemcom_f8:80:f0","Spanning-tree-(for-bridges)_00","STP","60","Conf. Root = 0/1/00:26:86:00:00:00  Cost = 90  Port = 0x8006"
"9","2.882967","192.168.2.212","149.112.122.10","TCP","66","52044  >  443 [SYN] Seq=0 Win=64240 Len=0 MSS=1460 WS=256 SACK_PERM"
"10","2.896517","192.168.2.212","160.36.131.221","TCP","66","52045  >  443 [SYN] Seq=0 Win=64240 Len=0 MSS=1460 WS=256 SACK_PERM"
"11","2.898822","149.112.122.10","192.168.2.212","TCP","66","443  >  52044 [SYN, ACK] Seq=0 Ack=1 Win=29200 Len=0 MSS=1452 SACK_PERM WS=512"
"12","2.898948","192.168.2.212","149.112.122.10","TCP","54","52044  >  443 [ACK] Seq=1 Ack=1 Win=262656 Len=0"
"13","2.905118","192.168.2.212","149.112.122.10","TLSv1.3","682","Client Hello"
"14","2.910982","192.168.2.212","160.36.131.221","TCP","66","52046  >  443 [SYN] Seq=0 Win=64240 Len=0 MSS=1460 WS=256 SACK_PERM"
"15","2.919692","149.112.122.10","192.168.2.212","TCP","60","443  >  52044 [ACK] Seq=1 Ack=629 Win=30720 Len=0"
"16","2.920834","149.112.122.10","192.168.2.212","TLSv1.3","1506","Server Hello, Change Cipher Spec, Application Data"
"17","2.920834","149.112.122.10","192.168.2.212","TCP","705","[TCP Previous segment not captured] 443  >  52044 [PSH, ACK] Seq=2905 Ack=629 Win=30720 Len=651 [TCP segment of a reassembled PDU], Application Data, Application Data"
"18","2.920834","149.112.122.10","192.168.2.212","TCP","1506","[TCP Out-Of-Order] 443  >  52044 [ACK] Seq=1453 Ack=629 Win=30720 Len=1452"
"19","2.920986","192.168.2.212","149.112.122.10","TCP","66","52044  >  443 [ACK] Seq=629 Ack=1453 Win=262656 Len=0 SLE=2905 SRE=3556"
"20","2.921026","192.168.2.212","149.112.122.10","TCP","54","52044  >  443 [ACK] Seq=629 Ack=3556 Win=262656 Len=0"
"21","2.937027","160.36.131.221","192.168.2.212","TCP","66","443  >  52045 [SYN, ACK] Seq=0 Ack=1 Win=14600 Len=0 MSS=1452 SACK_PERM WS=128"
"22","2.937163","192.168.2.212","160.36.131.221","TCP","54","52045  >  443 [ACK] Seq=1 Ack=1 Win=262656 Len=0"
"23","2.941513","192.168.2.212","160.36.131.221","TLSv1.2","571","Client Hello"
"24","2.950702","160.36.131.221","192.168.2.212","TCP","66","443  >  52046 [SYN, ACK] Seq=0 Ack=1 Win=14600 Len=0 MSS=1452 SACK_PERM WS=128"
"25","2.950804","192.168.2.212","160.36.131.221","TCP","54","52046  >  443 [ACK] Seq=1 Ack=1 Win=262656 Len=0"
"26","2.956575","192.168.2.212","160.36.131.221","TLSv1.2","571","Client Hello"
"27","2.982652","160.36.131.221","192.168.2.212","TCP","60","443  >  52045 [ACK] Seq=1 Ack=518 Win=15744 Len=0"
"28","2.987088","160.36.131.221","192.168.2.212","TLSv1.2","1506","Server Hello"
"29","2.987088","160.36.131.221","192.168.2.212","TCP","1506","[TCP Previous segment not captured] 443  >  52045 [ACK] Seq=2905 Ack=518 Win=15744 Len=1452 [TCP segment of a reassembled PDU]"
"30","2.987088","160.36.131.221","192.168.2.212","TCP","1506","[TCP Out-Of-Order] 443  >  52045 [ACK] Seq=1453 Ack=518 Win=15744 Len=1452 [TCP segment of a reassembled PDU]"
"31","2.987088","160.36.131.221","192.168.2.212","TLSv1.2","485","Certificate, Server Key Exchange, Server Hello Done"
"32","2.987251","192.168.2.212","160.36.131.221","TCP","66","52045  >  443 [ACK] Seq=518 Ack=1453 Win=262656 Len=0 SLE=2905 SRE=4357"
"33","2.987312","192.168.2.212","160.36.131.221","TCP","54","52045  >  443 [ACK] Seq=518 Ack=4357 Win=262656 Len=0"
"34","2.987347","192.168.2.212","160.36.131.221","TCP","54","52045  >  443 [ACK] Seq=518 Ack=4788 Win=262144 Len=0"
"35","2.994674","160.36.131.221","192.168.2.212","TCP","60","443  >  52046 [ACK] Seq=1 Ack=518 Win=15744 Len=0"
"36","2.999390","160.36.131.221","192.168.2.212","TLSv1.2","1506","[TCP Previous segment not captured] , Ignored Unknown Record"
"37","2.999390","160.36.131.221","192.168.2.212","TLSv1.2","485","[TCP Previous segment not captured] , Ignored Unknown Record"
"38","2.999390","160.36.131.221","192.168.2.212","TCP","1506","[TCP Out-Of-Order] 443  >  52046 [ACK] Seq=1 Ack=518 Win=15744 Len=1452"
"39","2.999390","160.36.131.221","192.168.2.212","TCP","1506","[TCP Out-Of-Order] 443  >  52046 [ACK] Seq=2905 Ack=518 Win=15744 Len=1452"
"40","2.999450","192.168.2.212","160.36.131.221","TCP","66","[TCP Dup ACK 25#1] 52046  >  443 [ACK] Seq=518 Ack=1 Win=262656 Len=0 SLE=1453 SRE=2905"
"41","2.999470","192.168.2.212","160.36.131.221","TCP","74","[TCP Dup ACK 25#2] 52046  >  443 [ACK] Seq=518 Ack=1 Win=262656 Len=0 SLE=4357 SRE=4788 SLE=1453 SRE=2905"
"42","2.999515","192.168.2.212","160.36.131.221","TCP","66","52046  >  443 [ACK] Seq=518 Ack=2905 Win=262656 Len=0 SLE=4357 SRE=4788"
"43","2.999547","192.168.2.212","160.36.131.221","TCP","54","52046  >  443 [ACK] Seq=518 Ack=4788 Win=262656 Len=0"
"44","3.003138","192.168.2.212","160.36.131.221","TLSv1.2","180","Client Key Exchange, Change Cipher Spec, Encrypted Handshake Message"
"45","3.010215","192.168.2.212","160.36.131.221","TLSv1.2","180","Client Key Exchange, Change Cipher Spec, Encrypted Handshake Message"
"46","3.037097","160.36.131.221","192.168.2.212","TCP","1506","[TCP Spurious Retransmission] 443  >  52046 [ACK] Seq=1 Ack=518 Win=15744 Len=1452"
"47","3.037097","160.36.131.221","192.168.2.212","TCP","1506","[TCP Spurious Retransmission] 443  >  52046 [ACK] Seq=2905 Ack=518 Win=15744 Len=1452"
"48","3.037202","192.168.2.212","160.36.131.221","TCP","66","[TCP Dup ACK 43#1] 52046  >  443 [ACK] Seq=644 Ack=4788 Win=262656 Len=0 SLE=1 SRE=1453"
"49","3.037219","192.168.2.212","160.36.131.221","TCP","66","[TCP Dup ACK 43#2] 52046  >  443 [ACK] Seq=644 Ack=4788 Win=262656 Len=0 SLE=2905 SRE=4357"
"50","3.043814","160.36.131.221","192.168.2.212","TLSv1.2","105","Change Cipher Spec, Encrypted Handshake Message"
"51","3.048325","160.36.131.221","192.168.2.212","TLSv1.2","105","Change Cipher Spec, Encrypted Handshake Message"
"52","3.048598","192.168.2.212","160.36.131.221","TLSv1.2","582","Application Data"
"53","3.054229","192.168.2.10","239.255.255.250","IPv4","1506","Fragmented IP protocol (proto=UDP 17, off=0, ID=59e4) [Reassembled in #54]"
"54","3.054229","192.168.2.10","239.255.255.250","UDP","639","1071  >  8082 Len=2069"
"55","3.061747","192.168.2.206","239.255.255.250","SSDP","139","M-SEARCH * HTTP/1.1 "
"56","3.087300","160.36.131.221","192.168.2.212","TLSv1.2","1506","[TCP Previous segment not captured] , Ignored Unknown Record"
"57","3.087300","160.36.131.221","192.168.2.212","TCP","1506","[TCP Out-Of-Order] 443  >  52046 [ACK] Seq=4839 Ack=1172 Win=16768 Len=1452"
"58","3.087300","160.36.131.221","192.168.2.212","TLSv1.2","1506","[TCP Previous segment not captured] , Ignored Unknown Record"
"59","3.087300","160.36.131.221","192.168.2.212","TCP","1506","[TCP Out-Of-Order] 443  >  52046 [ACK] Seq=7743 Ack=1172 Win=16768 Len=1452"
"60","3.087300","160.36.131.221","192.168.2.212","TLSv1.2","1506","[TCP Previous segment not captured] , Ignored Unknown Record"
"61","3.087300","160.36.131.221","192.168.2.212","TCP","1506","[TCP Out-Of-Order] 443  >  52046 [ACK] Seq=10647 Ack=1172 Win=16768 Len=1452"
"62","3.087411","192.168.2.212","160.36.131.221","TCP","66","[TCP Dup ACK 52#1] 52046  >  443 [ACK] Seq=1172 Ack=4839 Win=262656 Len=0 SLE=6291 SRE=7743"
"63","3.087496","192.168.2.212","160.36.131.221","TCP","54","52046  >  443 [ACK] Seq=1172 Ack=7743 Win=262656 Len=0"
"64","3.087529","192.168.2.212","160.36.131.221","TCP","66","[TCP Dup ACK 63#1] 52046  >  443 [ACK] Seq=1172 Ack=7743 Win=262656 Len=0 SLE=9195 SRE=10647"
"65","3.087566","192.168.2.212","160.36.131.221","TCP","54","52046  >  443 [ACK] Seq=1172 Ack=10647 Win=262656 Len=0"
"66","3.087594","192.168.2.212","160.36.131.221","TCP","66","[TCP Dup ACK 65#1] 52046  >  443 [ACK] Seq=1172 Ack=10647 Win=262656 Len=0 SLE=12099 SRE=13551"
"67","3.087619","192.168.2.212","160.36.131.221","TCP","54","52046  >  443 [ACK] Seq=1172 Ack=13551 Win=262656 Len=0"
"68","3.099786","192.168.2.212","160.36.131.221","TCP","54","52045  >  443 [ACK] Seq=644 Ack=4839 Win=262144 Len=0"
"69","3.124825","160.36.131.221","192.168.2.212","TLSv1.2","1506","Ignored Unknown Record"
"70","3.124825","160.36.131.221","192.168.2.212","TLSv1.2","1506","Ignored Unknown Record"
"71","3.124825","160.36.131.221","192.168.2.212","TLSv1.2","1506","Ignored Unknown Record"
"72","3.124825","160.36.131.221","192.168.2.212","TLSv1.2","1506","[TCP Previous segment not captured] , Ignored Unknown Record"
"73","3.124825","160.36.131.221","192.168.2.212","TCP","1506","[TCP Out-Of-Order] 443  >  52046 [ACK] Seq=17907 Ack=1172 Win=16768 Len=1452"
"74","3.124825","160.36.131.221","192.168.2.212","TLSv1.2","1506","[TCP Previous segment not captured] , Ignored Unknown Record"
"75","3.124825","160.36.131.221","192.168.2.212","TCP","1506","[TCP Out-Of-Order] 443  >  52046 [PSH, ACK] Seq=20811 Ack=1172 Win=16768 Len=1452"
"76","3.124825","160.36.131.221","192.168.2.212","TCP","1506","[TCP Previous segment not captured] 443  >  52046 [ACK] Seq=25167 Ack=1172 Win=16768 Len=1452"
"77","3.124825","160.36.131.221","192.168.2.212","TCP","1506","[TCP Out-Of-Order] 443  >  52046 [ACK] Seq=23715 Ack=1172 Win=16768 Len=1452"
"78","3.124951","192.168.2.212","160.36.131.221","TCP","66","52046  >  443 [ACK] Seq=1172 Ack=17907 Win=262656 Len=0 SLE=19359 SRE=20811"
"79","3.124985","192.168.2.212","160.36.131.221","TCP","54","52046  >  443 [ACK] Seq=1172 Ack=20811 Win=262656 Len=0"
"80","3.124995","192.168.2.212","160.36.131.221","TCP","66","[TCP Dup ACK 79#1] 52046  >  443 [ACK] Seq=1172 Ack=20811 Win=262656 Len=0 SLE=22263 SRE=23715"
"81","3.125014","192.168.2.212","160.36.131.221","TCP","54","52046  >  443 [ACK] Seq=1172 Ack=23715 Win=262656 Len=0"
"82","3.125026","192.168.2.212","160.36.131.221","TCP","66","[TCP Dup ACK 81#1] 52046  >  443 [ACK] Seq=1172 Ack=23715 Win=262656 Len=0 SLE=25167 SRE=26619"
"83","3.125048","192.168.2.212","160.36.131.221","TCP","54","52046  >  443 [ACK] Seq=1172 Ack=26619 Win=262656 Len=0"
"84","3.162761","160.36.131.221","192.168.2.212","TLSv1.2","1506","Ignored Unknown Record"
"85","3.162761","160.36.131.221","192.168.2.212","TLSv1.2","1506","[TCP Previous segment not captured] , Ignored Unknown Record"
"86","3.162761","160.36.131.221","192.168.2.212","TCP","1506","[TCP Out-Of-Order] 443  >  52046 [ACK] Seq=28071 Ack=1172 Win=16768 Len=1452"
"87","3.162761","160.36.131.221","192.168.2.212","TLSv1.2","1506","[TCP Previous segment not captured] , Ignored Unknown Record"
"88","3.162761","160.36.131.221","192.168.2.212","TCP","1506","[TCP Out-Of-Order] 443  >  52046 [ACK] Seq=30975 Ack=1172 Win=16768 Len=1452"
"89","3.162761","160.36.131.221","192.168.2.212","TLSv1.2","1506","Ignored Unknown Record"
"90","3.162761","160.36.131.221","192.168.2.212","TLSv1.2","1506","Ignored Unknown Record"
"91","3.162761","160.36.131.221","192.168.2.212","TLSv1.2","1258","Ignored Unknown Record"
"92","3.162761","160.36.131.221","192.168.2.212","TLSv1.2","1506","[TCP Previous segment not captured] , Ignored Unknown Record"
"93","3.162761","160.36.131.221","192.168.2.212","TCP","1506","[TCP Out-Of-Order] 443  >  52046 [ACK] Seq=37987 Ack=1172 Win=16768 Len=1452"
"94","3.162891","192.168.2.212","160.36.131.221","TCP","66","52046  >  443 [ACK] Seq=1172 Ack=28071 Win=262656 Len=0 SLE=29523 SRE=30975"
"95","3.162945","192.168.2.212","160.36.131.221","TCP","54","52046  >  443 [ACK] Seq=1172 Ack=30975 Win=262656 Len=0"
"96","3.162966","192.168.2.212","160.36.131.221","TCP","66","[TCP Dup ACK 95#1] 52046  >  443 [ACK] Seq=1172 Ack=30975 Win=262656 Len=0 SLE=32427 SRE=33879"
"97","3.162997","192.168.2.212","160.36.131.221","TCP","54","52046  >  443 [ACK] Seq=1172 Ack=33879 Win=262656 Len=0"
"98","3.163046","192.168.2.212","160.36.131.221","TCP","66","52046  >  443 [ACK] Seq=1172 Ack=37987 Win=262656 Len=0 SLE=39439 SRE=40891"
"99","3.163073","192.168.2.212","160.36.131.221","TCP","54","52046  >  443 [ACK] Seq=1172 Ack=40891 Win=262656 Len=0"
"100","3.200592","160.36.131.221","192.168.2.212","TLSv1.2","1506","[TCP Previous segment not captured] , Ignored Unknown Record"
"101","3.200592","160.36.131.221","192.168.2.212","TCP","1506","[TCP Out-Of-Order] 443  >  52046 [ACK] Seq=42343 Ack=1172 Win=16768 Len=1452"
"102","3.200592","160.36.131.221","192.168.2.212","TLSv1.2","1506","Ignored Unknown Record"
"103","3.200592","160.36.131.221","192.168.2.212","TLSv1.2","1506","Ignored Unknown Record"
"104","3.200592","160.36.131.221","192.168.2.212","TLSv1.2","1506","Ignored Unknown Record"
"105","3.200592","160.36.131.221","192.168.2.212","TLSv1.2","1506","[TCP Previous segment not captured] , Ignored Unknown Record"
"106","3.200592","160.36.131.221","192.168.2.212","TCP","1506","[TCP Out-Of-Order] 443  >  52046 [ACK] Seq=49603 Ack=1172 Win=16768 Len=1452"
"107","3.200592","160.36.131.221","192.168.2.212","TLSv1.2","1506","[TCP Previous segment not captured] , Ignored Unknown Record"
"108","3.200592","160.36.131.221","192.168.2.212","TCP","1506","[TCP Out-Of-Order] 443  >  52046 [ACK] Seq=52507 Ack=1172 Win=16768 Len=1452"
"109","3.200592","160.36.131.221","192.168.2.212","TLSv1.2","1506","[TCP Previous segment not captured] , Ignored Unknown Record"
"110","3.200667","192.168.2.212","160.36.131.221","TCP","66","[TCP Dup ACK 99#1] 52046  >  443 [ACK] Seq=1172 Ack=40891 Win=262656 Len=0 SLE=43795 SRE=45247"
"111","3.200691","192.168.2.212","160.36.131.221","TCP","66","[TCP Dup ACK 99#2] 52046  >  443 [ACK] Seq=1172 Ack=40891 Win=262656 Len=0 SLE=42343 SRE=45247"
"112","3.200712","192.168.2.212","160.36.131.221","TCP","66","[TCP Dup ACK 99#3] 52046  >  443 [ACK] Seq=1172 Ack=40891 Win=262656 Len=0 SLE=42343 SRE=49603"
"113","3.200728","192.168.2.212","160.36.131.221","TCP","74","[TCP Dup ACK 99#4] 52046  >  443 [ACK] Seq=1172 Ack=40891 Win=262656 Len=0 SLE=51055 SRE=52507 SLE=42343 SRE=49603"
"114","3.200748","192.168.2.212","160.36.131.221","TCP","66","[TCP Dup ACK 99#5] 52046  >  443 [ACK] Seq=1172 Ack=40891 Win=262656 Len=0 SLE=42343 SRE=52507"
"115","3.200759","192.168.2.212","160.36.131.221","TCP","74","[TCP Dup ACK 99#6] 52046  >  443 [ACK] Seq=1172 Ack=40891 Win=262656 Len=0 SLE=53959 SRE=55411 SLE=42343 SRE=52507"
"116","3.200770","192.168.2.212","160.36.131.221","TCP","66","[TCP Dup ACK 99#7] 52046  >  443 [ACK] Seq=1172 Ack=40891 Win=262656 Len=0 SLE=42343 SRE=55411"
"117","3.200782","192.168.2.212","160.36.131.221","TCP","74","[TCP Dup ACK 99#8] 52046  >  443 [ACK] Seq=1172 Ack=40891 Win=262656 Len=0 SLE=56863 SRE=58315 SLE=42343 SRE=55411"
"118","3.238566","160.36.131.221","192.168.2.212","TLSv1.2","1506","[TCP Previous segment not captured] , Ignored Unknown Record"
"119","3.238566","160.36.131.221","192.168.2.212","TLSv1.2","1506","Ignored Unknown Record"
"120","3.238566","160.36.131.221","192.168.2.212","TCP","1506","[TCP Out-Of-Order] 443  >  52046 [ACK] Seq=40891 Ack=1172 Win=16768 Len=1452"
"121","3.238566","160.36.131.221","192.168.2.212","TLSv1.2","1506","Ignored Unknown Record"
"122","3.238566","160.36.131.221","192.168.2.212","TLSv1.2","1506","Ignored Unknown Record"
"123","3.238566","160.36.131.221","192.168.2.212","TLSv1.2","1506","Ignored Unknown Record"
"124","3.238566","160.36.131.221","192.168.2.212","TLSv1.2","1506","Ignored Unknown Record"
"125","3.238566","160.36.131.221","192.168.2.212","TLSv1.2","1506","Ignored Unknown Record"
"126","3.238566","160.36.131.221","192.168.2.212","TLSv1.2","1506","Ignored Unknown Record"
"127","3.238672","192.168.2.212","160.36.131.221","TCP","82","[TCP Dup ACK 99#9] 52046  >  443 [ACK] Seq=1172 Ack=40891 Win=262656 Len=0 SLE=59767 SRE=62671 SLE=56863 SRE=58315 SLE=42343 SRE=55411"
"128","3.238756","192.168.2.212","160.36.131.221","TCP","74","52046  >  443 [ACK] Seq=1172 Ack=55411 Win=262656 Len=0 SLE=59767 SRE=62671 SLE=56863 SRE=58315"
"129","3.238788","192.168.2.212","160.36.131.221","TCP","74","[TCP Dup ACK 128#1] 52046  >  443 [ACK] Seq=1172 Ack=55411 Win=262656 Len=0 SLE=59767 SRE=71383 SLE=56863 SRE=58315"
"130","3.277923","160.36.131.221","192.168.2.212","TCP","1506","[TCP Out-Of-Order] 443  >  52046 [PSH, ACK] Seq=55411 Ack=1172 Win=16768 Len=1452"
"131","3.277923","160.36.131.221","192.168.2.212","TCP","1506","[TCP Out-Of-Order] 443  >  52046 [ACK] Seq=58315 Ack=1172 Win=16768 Len=1452"
"132","3.277923","160.36.131.221","192.168.2.212","TLSv1.2","1506","Ignored Unknown Record"
"133","3.277923","160.36.131.221","192.168.2.212","TLSv1.2","1506","Ignored Unknown Record"
"134","3.277923","160.36.131.221","192.168.2.212","TLSv1.2","1506","Ignored Unknown Record"
"135","3.277923","160.36.131.221","192.168.2.212","TLSv1.2","1506","Ignored Unknown Record"
"136","3.277923","160.36.131.221","192.168.2.212","TLSv1.2","1506","Ignored Unknown Record"
"137","3.277923","160.36.131.221","192.168.2.212","TLSv1.2","1506","Ignored Unknown Record"
"138","3.277923","160.36.131.221","192.168.2.212","TLSv1.2","1506","Ignored Unknown Record"
"139","3.278137","192.168.2.212","160.36.131.221","TCP","66","52046  >  443 [ACK] Seq=1172 Ack=58315 Win=262656 Len=0 SLE=59767 SRE=71383"
"140","3.278204","192.168.2.212","160.36.131.221","TCP","54","52046  >  443 [ACK] Seq=1172 Ack=71383 Win=262656 Len=0"
"141","3.278243","192.168.2.212","160.36.131.221","TCP","54","52046  >  443 [ACK] Seq=1172 Ack=81547 Win=262656 Len=0"
"142","3.294744","Sagemcom_f8:80:f0","Spanning-tree-(for-bridges)_00","STP","56","Conf. Root = 32768/0/84:a0:6e:f8:80:f1  Cost = 0  Port = 0x8003"
"143","3.315748","160.36.131.221","192.168.2.212","TLSv1.2","1506","Ignored Unknown Record"
"144","3.315748","160.36.131.221","192.168.2.212","TLSv1.2","1506","Ignored Unknown Record"
"145","3.315748","160.36.131.221","192.168.2.212","TLSv1.2","1506","[TCP Previous segment not captured] , Ignored Unknown Record"
"146","3.315748","160.36.131.221","192.168.2.212","TCP","1506","[TCP Out-Of-Order] 443  >  52046 [ACK] Seq=84451 Ack=1172 Win=16768 Len=1452"
"147","3.315748","160.36.131.221","192.168.2.212","TLSv1.2","1506","Ignored Unknown Record"
"148","3.315748","160.36.131.221","192.168.2.212","TLSv1.2","1506","Ignored Unknown Record"
"149","3.315748","160.36.131.221","192.168.2.212","TLSv1.2","1506","Ignored Unknown Record"
"150","3.315748","160.36.131.221","192.168.2.212","TLSv1.2","1506","Ignored Unknown Record"
"151","3.315748","160.36.131.221","192.168.2.212","TLSv1.2","1506","Ignored Unknown Record"
"152","3.315748","160.36.131.221","192.168.2.212","TLSv1.2","1506","Ignored Unknown Record"
"153","3.315869","192.168.2.212","160.36.131.221","TCP","66","52046  >  443 [ACK] Seq=1172 Ack=84451 Win=262656 Len=0 SLE=85903 SRE=87355"
"154","3.315908","192.168.2.212","160.36.131.221","TCP","54","52046  >  443 [ACK] Seq=1172 Ack=87355 Win=262656 Len=0"
"155","3.315944","192.168.2.212","160.36.131.221","TCP","54","52046  >  443 [ACK] Seq=1172 Ack=96067 Win=262656 Len=0"
"156","3.358392","160.36.131.221","192.168.2.212","TLSv1.2","1506","Ignored Unknown Record"
"157","3.358392","160.36.131.221","192.168.2.212","TLSv1.2","1506","[TCP Previous segment not captured] , Ignored Unknown Record"
"158","3.358392","160.36.131.221","192.168.2.212","TCP","1506","[TCP Out-Of-Order] 443  >  52046 [PSH, ACK] Seq=97519 Ack=1172 Win=16768 Len=1452"
"159","3.358392","160.36.131.221","192.168.2.212","TLSv1.2","1506","[TCP Previous segment not captured] , Ignored Unknown Record"
"160","3.358392","160.36.131.221","192.168.2.212","TCP","1506","[TCP Out-Of-Order] 443  >  52046 [ACK] Seq=100423 Ack=1172 Win=16768 Len=1452"
"161","3.358392","160.36.131.221","192.168.2.212","TLSv1.2","1506","Ignored Unknown Record"
"162","3.358392","160.36.131.221","192.168.2.212","TLSv1.2","1506","Ignored Unknown Record"
"163","3.358392","160.36.131.221","192.168.2.212","TLSv1.2","1506","[TCP Previous segment not captured] , Ignored Unknown Record"
"164","3.358392","160.36.131.221","192.168.2.212","TCP","1506","[TCP Out-Of-Order] 443  >  52046 [ACK] Seq=106231 Ack=1172 Win=16768 Len=1452"
"165","3.358392","160.36.131.221","192.168.2.212","TLSv1.2","1506","Ignored Unknown Record"
"166","3.358587","192.168.2.212","160.36.131.221","TCP","66","52046  >  443 [ACK] Seq=1172 Ack=97519 Win=262656 Len=0 SLE=98971 SRE=100423"
"167","3.358651","192.168.2.212","160.36.131.221","TCP","54","52046  >  443 [ACK] Seq=1172 Ack=100423 Win=262656 Len=0"
"168","3.358669","192.168.2.212","160.36.131.221","TCP","66","[TCP Dup ACK 167#1] 52046  >  443 [ACK] Seq=1172 Ack=100423 Win=262656 Len=0 SLE=101875 SRE=103327"
"169","3.358714","192.168.2.212","160.36.131.221","TCP","54","52046  >  443 [ACK] Seq=1172 Ack=103327 Win=262656 Len=0"
"170","3.358749","192.168.2.212","160.36.131.221","TCP","66","52046  >  443 [ACK] Seq=1172 Ack=106231 Win=262656 Len=0 SLE=107683 SRE=109135"
"171","3.358776","192.168.2.212","160.36.131.221","TCP","54","52046  >  443 [ACK] Seq=1172 Ack=109135 Win=262656 Len=0"
"172","3.358823","192.168.2.212","160.36.131.221","TCP","54","52046  >  443 [ACK] Seq=1172 Ack=110587 Win=262656 Len=0"
"173","3.396213","160.36.131.221","192.168.2.212","TLSv1.2","1506","Ignored Unknown Record"
"174","3.396213","160.36.131.221","192.168.2.212","TLSv1.2","1506","Ignored Unknown Record"
"175","3.396213","160.36.131.221","192.168.2.212","TLSv1.2","1506","Ignored Unknown Record"
"176","3.396213","160.36.131.221","192.168.2.212","TLSv1.2","1506","Ignored Unknown Record"
"177","3.396213","160.36.131.221","192.168.2.212","TLSv1.2","1506","Ignored Unknown Record"
"178","3.396213","160.36.131.221","192.168.2.212","TLSv1.2","1506","[TCP Previous segment not captured] , Ignored Unknown Record"
"179","3.396213","160.36.131.221","192.168.2.212","TCP","1506","[TCP Out-Of-Order] 443  >  52046 [ACK] Seq=117847 Ack=1172 Win=16768 Len=1452"
"180","3.396213","160.36.131.221","192.168.2.212","TLSv1.2","1506","Ignored Unknown Record"
"181","3.396213","160.36.131.221","192.168.2.212","TLSv1.2","1506","Ignored Unknown Record"
"182","3.396213","160.36.131.221","192.168.2.212","TLSv1.2","1506","Ignored Unknown Record"
"183","3.396369","192.168.2.212","160.36.131.221","TCP","66","52046  >  443 [ACK] Seq=1172 Ack=117847 Win=262656 Len=0 SLE=119299 SRE=120751"
"184","3.396415","192.168.2.212","160.36.131.221","TCP","54","52046  >  443 [ACK] Seq=1172 Ack=120751 Win=262656 Len=0"
"185","3.396456","192.168.2.212","160.36.131.221","TCP","54","52046  >  443 [ACK] Seq=1172 Ack=125107 Win=262656 Len=0"
"186","3.434103","160.36.131.221","192.168.2.212","TLSv1.2","1506","[TCP Previous segment not captured] , Ignored Unknown Record"
"187","3.434103","160.36.131.221","192.168.2.212","TCP","1506","[TCP Out-Of-Order] 443  >  52046 [ACK] Seq=125107 Ack=1172 Win=16768 Len=1452"
"188","3.434103","160.36.131.221","192.168.2.212","TLSv1.2","1506","[TCP Previous segment not captured] , Ignored Unknown Record"
"189","3.434103","160.36.131.221","192.168.2.212","TCP","1506","[TCP Out-Of-Order] 443  >  52046 [ACK] Seq=128011 Ack=1172 Win=16768 Len=1452"
"190","3.434103","160.36.131.221","192.168.2.212","TLSv1.2","1506","[TCP Previous segment not captured] , Ignored Unknown Record"
"191","3.434103","160.36.131.221","192.168.2.212","TCP","1506","[TCP Out-Of-Order] 443  >  52046 [ACK] Seq=130915 Ack=1172 Win=16768 Len=1452"
"192","3.434103","160.36.131.221","192.168.2.212","TLSv1.2","1506","Ignored Unknown Record"
"193","3.434103","160.36.131.221","192.168.2.212","TLSv1.2","1506","Ignored Unknown Record"
"194","3.434189","192.168.2.212","160.36.131.221","TCP","66","[TCP Dup ACK 185#1] 52046  >  443 [ACK] Seq=1172 Ack=125107 Win=262656 Len=0 SLE=126559 SRE=128011"
"195","3.434286","192.168.2.212","160.36.131.221","TCP","54","52046  >  443 [ACK] Seq=1172 Ack=128011 Win=262656 Len=0"
"196","3.434302","192.168.2.212","160.36.131.221","TCP","66","[TCP Dup ACK 195#1] 52046  >  443 [ACK] Seq=1172 Ack=128011 Win=262656 Len=0 SLE=129463 SRE=130915"
"197","3.434325","192.168.2.212","160.36.131.221","TCP","54","52046  >  443 [ACK] Seq=1172 Ack=130915 Win=262656 Len=0"
"198","3.434333","192.168.2.212","160.36.131.221","TCP","66","[TCP Dup ACK 197#1] 52046  >  443 [ACK] Seq=1172 Ack=130915 Win=262656 Len=0 SLE=132367 SRE=133819"
"199","3.434351","192.168.2.212","160.36.131.221","TCP","54","52046  >  443 [ACK] Seq=1172 Ack=133819 Win=262656 Len=0"
"200","3.434371","192.168.2.212","160.36.131.221","TCP","54","52046  >  443 [ACK] Seq=1172 Ack=136723 Win=262656 Len=0"
"201","3.471781","160.36.131.221","192.168.2.212","TLSv1.2","1506","[TCP Previous segment not captured] , Ignored Unknown Record"
"202","3.471781","160.36.131.221","192.168.2.212","TCP","1506","[TCP Out-Of-Order] 443  >  52046 [ACK] Seq=136723 Ack=1172 Win=16768 Len=1452"
"203","3.471781","160.36.131.221","192.168.2.212","TLSv1.2","1506","Ignored Unknown Record"
"204","3.471781","160.36.131.221","192.168.2.212","TLSv1.2","1506","Ignored Unknown Record"
"205","3.471781","160.36.131.221","192.168.2.212","TLSv1.2","1506","Ignored Unknown Record"
"206","3.471781","160.36.131.221","192.168.2.212","TLSv1.2","1506","Ignored Unknown Record"
"207","3.471874","192.168.2.212","160.36.131.221","TCP","66","[TCP Dup ACK 200#1] 52046  >  443 [ACK] Seq=1172 Ack=136723 Win=262656 Len=0 SLE=138175 SRE=139627"
"208","3.471965","192.168.2.212","160.36.131.221","TCP","54","52046  >  443 [ACK] Seq=1172 Ack=139627 Win=262656 Len=0"
"209","3.472006","192.168.2.212","160.36.131.221","TCP","54","52046  >  443 [ACK] Seq=1172 Ack=145435 Win=262656 Len=0"
"210","3.472363","160.36.131.221","192.168.2.212","TLSv1.2","1506","Ignored Unknown Record"
"211","3.472363","160.36.131.221","192.168.2.212","TLSv1.2","1506","Ignored Unknown Record"
"212","3.472363","160.36.131.221","192.168.2.212","TLSv1.2","1506","Ignored Unknown Record"
"213","3.472363","160.36.131.221","192.168.2.212","TLSv1.2","1506","Ignored Unknown Record"
"214","3.472460","192.168.2.212","160.36.131.221","TCP","54","52046  >  443 [ACK] Seq=1172 Ack=151243 Win=262656 Len=0"
"215","3.509567","160.36.131.221","192.168.2.212","TLSv1.2","1506","Ignored Unknown Record"
"216","3.509567","160.36.131.221","192.168.2.212","TLSv1.2","1506","Ignored Unknown Record"
"217","3.509567","160.36.131.221","192.168.2.212","TLSv1.2","1506","Ignored Unknown Record"
"218","3.509567","160.36.131.221","192.168.2.212","TLSv1.2","1506","Ignored Unknown Record"
"219","3.509567","160.36.131.221","192.168.2.212","TLSv1.2","1506","Ignored Unknown Record"
"220","3.509567","160.36.131.221","192.168.2.212","TLSv1.2","1506","Ignored Unknown Record"
"221","3.509697","192.168.2.212","160.36.131.221","TCP","54","52046  >  443 [ACK] Seq=1172 Ack=159955 Win=262656 Len=0"
"222","3.510269","160.36.131.221","192.168.2.212","TLSv1.2","1506","Ignored Unknown Record"
"223","3.510269","160.36.131.221","192.168.2.212","TLSv1.2","1506","Ignored Unknown Record"
"224","3.510269","160.36.131.221","192.168.2.212","TLSv1.2","1506","Ignored Unknown Record"
"225","3.510269","160.36.131.221","192.168.2.212","TLSv1.2","1506","Ignored Unknown Record"
"226","3.510380","192.168.2.212","160.36.131.221","TCP","54","52046  >  443 [ACK] Seq=1172 Ack=165763 Win=262656 Len=0"
"227","3.547554","160.36.131.221","192.168.2.212","TCP","1506","443  >  52046 [ACK] Seq=165763 Ack=1172 Win=16768 Len=1452"
"228","3.547554","160.36.131.221","192.168.2.212","TLSv1.2","1506","Ignored Unknown Record"
"229","3.547554","160.36.131.221","192.168.2.212","TLSv1.2","1506","Ignored Unknown Record"
"230","3.547554","160.36.131.221","192.168.2.212","TLSv1.2","1506","Ignored Unknown Record"
"231","3.547554","160.36.131.221","192.168.2.212","TLSv1.2","1506","Ignored Unknown Record"
"232","3.547554","160.36.131.221","192.168.2.212","TLSv1.2","1506","Ignored Unknown Record"
"233","3.547554","160.36.131.221","192.168.2.212","TCP","1506","443  >  52046 [ACK] Seq=174475 Ack=1172 Win=16768 Len=1452 [TCP segment of a reassembled PDU]"
"234","3.547554","160.36.131.221","192.168.2.212","TCP","1506","443  >  52046 [ACK] Seq=175927 Ack=1172 Win=16768 Len=1452 [TCP segment of a reassembled PDU]"
"235","3.547554","160.36.131.221","192.168.2.212","TCP","1506","[TCP Previous segment not captured] 443  >  52046 [PSH, ACK] Seq=178831 Ack=1172 Win=16768 Len=1452 [TCP segment of a reassembled PDU]"
"236","3.547554","160.36.131.221","192.168.2.212","TCP","1506","[TCP Out-Of-Order] 443  >  52046 [ACK] Seq=177379 Ack=1172 Win=16768 Len=1452 [TCP segment of a reassembled PDU]"
"237","3.547696","192.168.2.212","160.36.131.221","TCP","66","52046  >  443 [ACK] Seq=1172 Ack=177379 Win=262656 Len=0 SLE=178831 SRE=180283"
"238","3.547735","192.168.2.212","160.36.131.221","TCP","54","52046  >  443 [ACK] Seq=1172 Ack=180283 Win=262656 Len=0"
"239","3.547780","160.36.131.221","192.168.2.212","TCP","1506","443  >  52046 [ACK] Seq=180283 Ack=1172 Win=16768 Len=1452 [TCP segment of a reassembled PDU]"
"240","3.547780","160.36.131.221","192.168.2.212","TCP","1506","443  >  52046 [ACK] Seq=181735 Ack=1172 Win=16768 Len=1452 [TCP segment of a reassembled PDU]"
"241","3.547832","192.168.2.212","160.36.131.221","TCP","54","52046  >  443 [ACK] Seq=1172 Ack=183187 Win=262656 Len=0"
"242","3.585960","160.36.131.221","192.168.2.212","TCP","1506","443  >  52046 [ACK] Seq=183187 Ack=1172 Win=16768 Len=1452 [TCP segment of a reassembled PDU]"
"243","3.585960","160.36.131.221","192.168.2.212","TCP","1506","443  >  52046 [ACK] Seq=184639 Ack=1172 Win=16768 Len=1452 [TCP segment of a reassembled PDU]"
"244","3.585960","160.36.131.221","192.168.2.212","TCP","1506","[TCP Previous segment not captured] 443  >  52046 [ACK] Seq=187543 Ack=1172 Win=16768 Len=1452 [TCP segment of a reassembled PDU]"
"245","3.585960","160.36.131.221","192.168.2.212","TCP","1506","[TCP Out-Of-Order] 443  >  52046 [ACK] Seq=186091 Ack=1172 Win=16768 Len=1452 [TCP segment of a reassembled PDU]"
"246","3.585960","160.36.131.221","192.168.2.212","TCP","1506","[TCP Previous segment not captured] 443  >  52046 [ACK] Seq=190447 Ack=1172 Win=16768 Len=1452 [TCP segment of a reassembled PDU]"
"247","3.585960","160.36.131.221","192.168.2.212","TCP","1506","[TCP Out-Of-Order] 443  >  52046 [ACK] Seq=188995 Ack=1172 Win=16768 Len=1452 [TCP segment of a reassembled PDU]"
"248","3.585960","160.36.131.221","192.168.2.212","TCP","1506","443  >  52046 [ACK] Seq=191899 Ack=1172 Win=16768 Len=1452 [TCP segment of a reassembled PDU]"
"249","3.585960","160.36.131.221","192.168.2.212","TCP","1506","443  >  52046 [ACK] Seq=193351 Ack=1172 Win=16768 Len=1452 [TCP segment of a reassembled PDU]"
"250","3.586232","192.168.2.212","160.36.131.221","TCP","66","52046  >  443 [ACK] Seq=1172 Ack=186091 Win=262656 Len=0 SLE=187543 SRE=188995"
"251","3.586287","192.168.2.212","160.36.131.221","TCP","54","52046  >  443 [ACK] Seq=1172 Ack=188995 Win=262656 Len=0"
"252","3.586304","192.168.2.212","160.36.131.221","TCP","66","[TCP Dup ACK 251#1] 52046  >  443 [ACK] Seq=1172 Ack=188995 Win=262656 Len=0 SLE=190447 SRE=191899"
"253","3.586335","192.168.2.212","160.36.131.221","TCP","54","52046  >  443 [ACK] Seq=1172 Ack=191899 Win=262656 Len=0"
"254","3.586360","192.168.2.212","160.36.131.221","TCP","54","52046  >  443 [ACK] Seq=1172 Ack=194803 Win=262656 Len=0"
"255","3.587994","192.168.2.13","239.255.255.250","UDP","506","1082  >  8082 Len=464"
"256","3.623916","160.36.131.221","192.168.2.212","TCP","1506","[TCP Previous segment not captured] 443  >  52046 [ACK] Seq=196255 Ack=1172 Win=16768 Len=1452 [TCP segment of a reassembled PDU]"
"257","3.623916","160.36.131.221","192.168.2.212","TCP","1506","[TCP Out-Of-Order] 443  >  52046 [ACK] Seq=194803 Ack=1172 Win=16768 Len=1452 [TCP segment of a reassembled PDU]"
"258","3.623916","160.36.131.221","192.168.2.212","TCP","1506","443  >  52046 [ACK] Seq=197707 Ack=1172 Win=16768 Len=1452 [TCP segment of a reassembled PDU]"
"259","3.623916","160.36.131.221","192.168.2.212","TCP","1506","443  >  52046 [ACK] Seq=199159 Ack=1172 Win=16768 Len=1452 [TCP segment of a reassembled PDU]"
"260","3.623916","160.36.131.221","192.168.2.212","TCP","1506","443  >  52046 [ACK] Seq=200611 Ack=1172 Win=16768 Len=1452 [TCP segment of a reassembled PDU]"
"261","3.623916","160.36.131.221","192.168.2.212","TCP","1506","443  >  52046 [PSH, ACK] Seq=202063 Ack=1172 Win=16768 Len=1452 [TCP segment of a reassembled PDU]"
"262","3.623916","160.36.131.221","192.168.2.212","TCP","1506","443  >  52046 [ACK] Seq=203515 Ack=1172 Win=16768 Len=1452 [TCP segment of a reassembled PDU]"
"263","3.623916","160.36.131.221","192.168.2.212","TCP","1506","443  >  52046 [ACK] Seq=204967 Ack=1172 Win=16768 Len=1452 [TCP segment of a reassembled PDU]"
"264","3.623916","160.36.131.221","192.168.2.212","TCP","1506","443  >  52046 [ACK] Seq=206419 Ack=1172 Win=16768 Len=1452 [TCP segment of a reassembled PDU]"
"265","3.623916","160.36.131.221","192.168.2.212","TCP","1506","443  >  52046 [ACK] Seq=207871 Ack=1172 Win=16768 Len=1452 [TCP segment of a reassembled PDU]"
"266","3.624022","192.168.2.212","160.36.131.221","TCP","66","[TCP Dup ACK 254#1] 52046  >  443 [ACK] Seq=1172 Ack=194803 Win=262656 Len=0 SLE=196255 SRE=197707"
"267","3.624110","192.168.2.212","160.36.131.221","TCP","54","52046  >  443 [ACK] Seq=1172 Ack=197707 Win=262656 Len=0"
"268","3.624152","192.168.2.212","160.36.131.221","TCP","54","52046  >  443 [ACK] Seq=1172 Ack=209323 Win=262656 Len=0"
"269","3.661965","160.36.131.221","192.168.2.212","TCP","1506","443  >  52046 [ACK] Seq=209323 Ack=1172 Win=16768 Len=1452 [TCP segment of a reassembled PDU]"
"270","3.661965","160.36.131.221","192.168.2.212","TCP","1506","443  >  52046 [ACK] Seq=210775 Ack=1172 Win=16768 Len=1452 [TCP segment of a reassembled PDU]"
"271","3.661965","160.36.131.221","192.168.2.212","TCP","1506","443  >  52046 [ACK] Seq=212227 Ack=1172 Win=16768 Len=1452 [TCP segment of a reassembled PDU]"
"272","3.661965","160.36.131.221","192.168.2.212","TCP","1506","443  >  52046 [ACK] Seq=213679 Ack=1172 Win=16768 Len=1452 [TCP segment of a reassembled PDU]"
"273","3.661965","160.36.131.221","192.168.2.212","TCP","1506","[TCP Previous segment not captured] 443  >  52046 [ACK] Seq=216583 Ack=1172 Win=16768 Len=1452 [TCP segment of a reassembled PDU]"
"274","3.661965","160.36.131.221","192.168.2.212","TCP","1506","[TCP Out-Of-Order] 443  >  52046 [ACK] Seq=215131 Ack=1172 Win=16768 Len=1452 [TCP segment of a reassembled PDU]"
"275","3.661965","160.36.131.221","192.168.2.212","TCP","1506","443  >  52046 [ACK] Seq=218035 Ack=1172 Win=16768 Len=1452 [TCP segment of a reassembled PDU]"
"276","3.661965","160.36.131.221","192.168.2.212","TLSv1.2","1506","Ignored Unknown Record"
"277","3.661965","160.36.131.221","192.168.2.212","TLSv1.2","1506","Ignored Unknown Record"
"278","3.661965","160.36.131.221","192.168.2.212","TLSv1.2","1506","Ignored Unknown Record"
"279","3.662089","192.168.2.212","160.36.131.221","TCP","66","52046  >  443 [ACK] Seq=1172 Ack=215131 Win=262656 Len=0 SLE=216583 SRE=218035"
"280","3.662130","192.168.2.212","160.36.131.221","TCP","54","52046  >  443 [ACK] Seq=1172 Ack=218035 Win=262656 Len=0"
"281","3.662162","192.168.2.212","160.36.131.221","TCP","54","52046  >  443 [ACK] Seq=1172 Ack=223843 Win=262656 Len=0"
"282","3.699507","160.36.131.221","192.168.2.212","TLSv1.2","1506","[TCP Previous segment not captured] , Ignored Unknown Record"
"283","3.699507","160.36.131.221","192.168.2.212","TCP","1506","[TCP Out-Of-Order] 443  >  52046 [ACK] Seq=223843 Ack=1172 Win=16768 Len=1452"
"284","3.699507","160.36.131.221","192.168.2.212","TLSv1.2","1506","[TCP Previous segment not captured] , Ignored Unknown Record"
"285","3.699507","160.36.131.221","192.168.2.212","TCP","1506","[TCP Out-Of-Order] 443  >  52046 [ACK] Seq=226747 Ack=1172 Win=16768 Len=1452"
"286","3.699507","160.36.131.221","192.168.2.212","TLSv1.2","1506","[TCP Previous segment not captured] , Ignored Unknown Record"
"287","3.699507","160.36.131.221","192.168.2.212","TCP","1506","[TCP Out-Of-Order] 443  >  52046 [ACK] Seq=229651 Ack=1172 Win=16768 Len=1452"
"288","3.699507","160.36.131.221","192.168.2.212","TLSv1.2","1506","Ignored Unknown Record"
"289","3.699507","160.36.131.221","192.168.2.212","TLSv1.2","1506","Ignored Unknown Record"
"290","3.699507","160.36.131.221","192.168.2.212","TLSv1.2","1506","[TCP Previous segment not captured] , Ignored Unknown Record"
"291","3.699507","160.36.131.221","192.168.2.212","TCP","1506","[TCP Out-Of-Order] 443  >  52046 [ACK] Seq=235459 Ack=1172 Win=16768 Len=1452"
"292","3.699633","192.168.2.212","160.36.131.221","TCP","66","[TCP Dup ACK 281#1] 52046  >  443 [ACK] Seq=1172 Ack=223843 Win=262656 Len=0 SLE=225295 SRE=226747"
"293","3.699728","192.168.2.212","160.36.131.221","TCP","54","52046  >  443 [ACK] Seq=1172 Ack=226747 Win=262656 Len=0"
"294","3.699750","192.168.2.212","160.36.131.221","TCP","66","[TCP Dup ACK 293#1] 52046  >  443 [ACK] Seq=1172 Ack=226747 Win=262656 Len=0 SLE=228199 SRE=229651"
"295","3.699788","192.168.2.212","160.36.131.221","TCP","54","52046  >  443 [ACK] Seq=1172 Ack=229651 Win=262656 Len=0"
"296","3.699804","192.168.2.212","160.36.131.221","TCP","66","[TCP Dup ACK 295#1] 52046  >  443 [ACK] Seq=1172 Ack=229651 Win=262656 Len=0 SLE=231103 SRE=232555"
"297","3.699844","192.168.2.212","160.36.131.221","TCP","54","52046  >  443 [ACK] Seq=1172 Ack=232555 Win=262656 Len=0"
"298","3.699882","192.168.2.212","160.36.131.221","TCP","66","52046  >  443 [ACK] Seq=1172 Ack=235459 Win=262656 Len=0 SLE=236911 SRE=238363"
"299","3.699932","192.168.2.212","160.36.131.221","TCP","54","52046  >  443 [ACK] Seq=1172 Ack=238363 Win=262656 Len=0"
"300","3.736354","160.36.131.221","192.168.2.212","TLSv1.2","1506","Ignored Unknown Record"
"301","3.736508","160.36.131.221","192.168.2.212","TLSv1.2","1506","[TCP Previous segment not captured] , Ignored Unknown Record"
"302","3.736508","160.36.131.221","192.168.2.212","TCP","1506","[TCP Out-Of-Order] 443  >  52046 [ACK] Seq=239815 Ack=1172 Win=16768 Len=1452"
"303","3.736508","160.36.131.221","192.168.2.212","TLSv1.2","1506","Ignored Unknown Record"
"304","3.736508","160.36.131.221","192.168.2.212","TLSv1.2","1506","Ignored Unknown Record"
"305","3.736508","160.36.131.221","192.168.2.212","TLSv1.2","1506","Ignored Unknown Record"
"306","3.736508","160.36.131.221","192.168.2.212","TLSv1.2","1506","[TCP Previous segment not captured] , Ignored Unknown Record"
"307","3.736508","160.36.131.221","192.168.2.212","TCP","1506","[TCP Out-Of-Order] 443  >  52046 [ACK] Seq=247075 Ack=1172 Win=16768 Len=1452"
"308","3.736508","160.36.131.221","192.168.2.212","TLSv1.2","1506","Ignored Unknown Record"
"309","3.736625","192.168.2.212","160.36.131.221","TCP","66","52046  >  443 [ACK] Seq=1172 Ack=239815 Win=262656 Len=0 SLE=241267 SRE=242719"
"310","3.736667","192.168.2.212","160.36.131.221","TCP","54","52046  >  443 [ACK] Seq=1172 Ack=242719 Win=262656 Len=0"
"311","3.736702","192.168.2.212","160.36.131.221","TCP","66","52046  >  443 [ACK] Seq=1172 Ack=247075 Win=262656 Len=0 SLE=248527 SRE=249979"
"312","3.736727","192.168.2.212","160.36.131.221","TCP","54","52046  >  443 [ACK] Seq=1172 Ack=249979 Win=262656 Len=0"
"313","3.736920","160.36.131.221","192.168.2.212","TLSv1.2","1506","Ignored Unknown Record"
"314","3.736958","192.168.2.212","160.36.131.221","TCP","54","52046  >  443 [ACK] Seq=1172 Ack=252883 Win=262656 Len=0"
"315","3.773429","160.36.131.221","192.168.2.212","TLSv1.2","1506","Ignored Unknown Record"
